<?xml version="1.0" encoding="UTF-8"?>
<XMLTooling xmlns:xsi="http://www.w3.org/2001/XMLSchema-instance" xmlns:ecp="urn:oasis:names:tc:SAML:2.0:profiles:SSO:ecp" xmlns="http://www.opensaml.org/xmltooling-config" xsi:schemaLocation="http://www.opensaml.org/xmltooling-config ../../src/schema/xmltooling-config.xsd">
 
    <!-- SAML 2.0 ECP Object providers -->
    <ObjectProviders>
        
        <!-- Request -->
        <ObjectProvider qualifiedName="ecp:Request">
            <BuilderClass className="org.opensaml.saml2.ecp.impl.RequestBuilder"/>
            <MarshallingClass className="org.opensaml.saml2.ecp.impl.RequestMarshaller"/>
            <UnmarshallingClass className="org.opensaml.saml2.ecp.impl.RequestUnmarshaller"/>
        </ObjectProvider>
        
        <!-- Response -->
        <ObjectProvider qualifiedName="ecp:Response">
            <BuilderClass className="org.opensaml.saml2.ecp.impl.ResponseBuilder"/>
            <MarshallingClass className="org.opensaml.saml2.ecp.impl.ResponseMarshaller"/>
            <UnmarshallingClass className="org.opensaml.saml2.ecp.impl.ResponseUnmarshaller"/>
        </ObjectProvider>
        
        <!-- RelayState -->
        <ObjectProvider qualifiedName="ecp:RelayState">
            <BuilderClass className="org.opensaml.saml2.ecp.impl.RelayStateBuilder"/>
            <MarshallingClass className="org.opensaml.saml2.ecp.impl.RelayStateMarshaller"/>
            <UnmarshallingClass className="org.opensaml.saml2.ecp.impl.RelayStateUnmarshaller"/>
        </ObjectProvider>
 
    </ObjectProviders>
 </XMLTooling>
